<?xml version="1.0" encoding="utf-8"?>
<Packages xmlns:xs="http://www.w3.org/2001/XMLSchema-instance" xs:noNamespaceSchemaLocation="packages.xsd">
  <Package Id="0" Category="Программы">
    <Author>Adobe</Author>
    <CompanySite>https://www.Adobe.com/</CompanySite>
    <Description>Программа для оформления фотографий</Description>
    <Icon Name="Photoshop" Foreground="#FFFFFFFF" Background="#FF78C696" />
    <License>5Q86W-TFPN7-K8VCJ-PH3CT</License>
    <Name>Photoshop</Name>
    <Tag>Не подшитые</Tag>
    <Version>Cloud CC6</Version>
  </Package>
  <Package Id="1" Category="Программы">
    <Author>Adobe</Author>
    <Description>Программа для оформления фотографий</Description>
    <Icon Name="Allustrator" Foreground="#FFFFFFFF" Background="#FFF17A07" />
    <Name>Illustrator</Name>
    <Tag>Не подшитые</Tag>
    <Version>Cloud CC6</Version>
  </Package>
  <Package Id="2" Category="Программы">
    <Author>Axure Software Solution</Author>
    <Description>Программа для создания прототипов сайтов</Description>
    <Name>Axure</Name>
    <Source>tytyty</Source>
    <Tag>Не подшитые</Tag>
    <Userfield Label="ewrr">ewrr</Userfield>
    <Version>RP 8</Version>
  </Package>
  <Package Id="3" Category="Программы">
    <Author>Andrei Kulabukhau</Author>
    <Description>Программа для измерения времени</Description>
    <Image Source="../Resources/User/Images/Programs.png" />
    <Name>LazyCure</Name>
    <Tag>Органазеры</Tag>
    <Version>0.10</Version>
  </Package>
  <Package Id="4" Category="Программы">
    <Author>Mozilla</Author>
    <Description>Программа для просмотра вебстраниц</Description>
    <Name>Firefox</Name>
    <Tag>Не подшитые</Tag>
    <Version>7.9.4</Version>
  </Package>
  <Package Id="5" Category="Программы">
    <Author>Google</Author>
    <Description>Программа для просмотра вебстраниц</Description>
    <Name>Chrome</Name>
    <Tag>Не подшитые</Tag>
    <Userfield Label="sadasdd">sadasdd</Userfield>
    <Version>8.5.0</Version>
  </Package>
  <Package Id="6" Category="Программы">
    <Author>Microsoft</Author>
    <Description>Программа для организации электронных писем</Description>
    <Image Source="../Resources/User/Images/Programs.png" />
    <Name>Microsoft Outlook</Name>
    <Tag>Офисные</Tag>
    <Version>2017</Version>
  </Package>
  <Package Id="7" Category="Программы">
    <Author>Microsoft</Author>
    <Description>Программа для написания, редактирования, оформления текста и многое другое.</Description>
    <Image Source="../Resources/User/Images/Programs.png" />
    <Name>Microsoft Word</Name>
    <Tag>Офисные</Tag>
    <Version>2017</Version>
  </Package>
  <Package Id="8" Category="Программы">
    <Author>Piriform</Author>
    <Description>Программа очиски компьютора</Description>
    <Image Source="../Resources/User/Images/Programs.png" />
    <Name>CCleaner</Name>
    <Tag>Оптимизатры</Tag>
    <Version>5.43.6520</Version>
  </Package>
  <Package Id="9" Category="Программы">
    <Author>ChemTable Software</Author>
    <Description>Программа для оптимизации, отчиски, дефрагментации реестра и многое другое</Description>
    <Image Source="../Resources/User/Images/Programs.png" />
    <Name>Reg Organizer</Name>
    <Tag>Оптимизатры</Tag>
    <Version>8.16</Version>
  </Package>
  <Package Id="10" Category="Программы">
    <Author>Неизвестно</Author>
    <Description>Программа организации задач</Description>
    <Image Source="../Resources/User/Images/Programs.png" />
    <Name>LeaderTask</Name>
    <Tag>Органазеры</Tag>
    <Version>6.0</Version>
  </Package>
  <Package Id="11" Category="Программы">
    <Author>Kasperski Lab</Author>
    <Description>Программа для защиты компютера от вирусов</Description>
    <Image Source="../Resources/User/Images/Programs.png" />
    <Name>Kasperski</Name>
    <Tag>Антивирусы</Tag>
    <Version>6.0</Version>
  </Package>
  <Package Id="12" Category="Программы">
    <Author>HQ Pty Ltd</Author>
    <Description>Многофункциональный редактор кода</Description>
    <Image Source="../Resources/User/Images/Programs.png" />
    <Name>Sublime Text 3</Name>
    <TagList>
      <Tag>Редакторы кода</Tag>
      <Tag>Инструменты вебразработчика</Tag>
    </TagList>
    <Version>3.1.1 Build 3176</Version>
  </Package>
  <Package Id="13" Category="Программы">
    <Author>Notepad++Team</Author>
    <Description>Удобный и мультифункциональный редактор кода</Description>
    <Image Source="../Resources/User/Images/Programs.png" />
    <Name>Notepad++</Name>
    <Tag>Редакторы кода</Tag>
    <Version>7.4.2</Version>
  </Package>
  <Package Id="14" Category="Программы">
    <Author>Microsoft</Author>
    <Description>Интегрированая среда разработки</Description>
    <Icon Name="ProgramIcon" Foreground="#FFFFFFFF" Background="#FF3676AE" />
    <Name>Microsoft Visual Studio</Name>
    <Tag>Офисные</Tag>
    <Version>14.0</Version>
  </Package>
  <Package Id="15" Category="Программы">
    <Author>Poligonic</Author>
    <Description>Программа для создания 3D моделей</Description>
    <Image Source="../Resources/User/Images/Programs.png" />
    <Name>Zbrush</Name>
    <Tag>3D Редакторы</Tag>
    <Version>10</Version>
  </Package>
  <Package Id="16" Category="Программы">
    <Author>NetBeans Software</Author>
    <Description>Интегрированая среда разработки</Description>
    <Image Source="../Resources/User/Images/Programs.png" />
    <Name>NetBeans</Name>
    <Tag>IDE</Tag>
    <Version>9.1.0</Version>
  </Package>
  <Package Id="17" Category="Программы">
    <Author>Discord Team</Author>
    <Description>Программа для создания сообществ</Description>
    <Name>Discord</Name>
    <Tag>Не подшитые</Tag>
    <Version>3.0</Version>
  </Package>
  <Package Id="18" Category="Программы">
    <Author>Slack Team</Author>
    <Description>Программа для создания сообществ</Description>
    <Image Source="../Resources/User/Images/Programs.png" />
    <Name>Slack</Name>
    <Tag>Меседжеры</Tag>
    <Version>2.2</Version>
  </Package>
  <Package Id="19" Category="Игры">
    <Author>CD Project Red</Author>
    <Description>Игра для романтиков на досуге мясников</Description>
    <Image Source="../Resources/User/Images/Games.png" />
    <Name>The Witcher 3 Wild Hunt</Name>
    <Tag>RPG</Tag>
    <Version>3.31</Version>
  </Package>
  <Package Id="20" Category="Игры">
    <Author>Mod Doc Software</Author>
    <Description>Игра для настоящих царей</Description>
    <Image Source="../Resources/User/Images/Games.png" />
    <Name>Empire Earth 2</Name>
    <Tag>Не подшитые</Tag>
    <Version>2.2</Version>
  </Package>
  <Package Id="21" Category="Драйвера">
    <Author>Realtek</Author>
    <Image Source="../Resources/User/Images/Drivers.png" />
    <Name>High Definition Audio</Name>
    <Tag>Звуковая карта</Tag>
    <Version>3.31</Version>
  </Package>
  <Package Id="22" Category="Драйвера">
    <Author>Logitech</Author>
    <Image Source="../Resources/User/Images/Drivers.png" />
    <Name>Logitech HD Webcam C270</Name>
    <Tag>Аксессуары</Tag>
    <Version>2.2</Version>
  </Package>
  <Package Id="24" Category="Моды">
    <Author>Logitech</Author>
    <Description>Качественный мод для 3 Ведьмака, который улучшит качество графики в игре.</Description>
    <Image Source="../Resources/User/Images/Mods.png" />
    <Name>1.000 Times Better 2.3.1</Name>
    <Tag>Реворк</Tag>
    <Version>2.3.1</Version>
  </Package>
  <Package Id="25" Category="Игры">
    <Author>Valve</Author>
    <Description>Игра для настоящих ассов</Description>
    <Image Source="../Resources/User/Images/Games.png" />
    <Name>Counter Strike GO</Name>
    <Tag>Shooter</Tag>
    <Version>2.2</Version>
  </Package>
  <Package Id="27" Category="Программы">
    <Author>Liquid Technogies Limited</Author>
    <Description>Среда разработки XML проектов.</Description>
    <License>EMBRACED XXXXXXX</License>
    <Image Source="../Resources/User/Images/Programs.png" />
    <Name>XML Studio Developer</Name>
    <Tag>IDE</Tag>
    <Userfield Label="Лозунг">Build on 28.02.2011 (Build No : 3078)</Userfield>
    <Version>9.0.11.3078</Version>
  </Package>
  <Package Id="28" Category="Плагины">
    <Author>фывфыв</Author>
    <Description>фывфыв</Description>
    <Image Source="../Resources/User/Images/Plugins.png" />
    <Name>фвфыф</Name>
    <Tag>Не подшитые</Tag>
    <Version>фывфывф</Version>
  </Package>
  <Package Id="29" Category="Плагины">
    <Author>фывфыв</Author>
    <Description>фывфыв</Description>
    <Image Source="../Resources/User/Images/Plugins.png" />
    <Name>фвфыф</Name>
    <Tag>Не подшитые</Tag>
    <Version>фывфывф</Version>
  </Package>
</Packages>